{
  "$schema": "../../../../../../tools/World/CanonicalCompilation/contracts/compiler-profile.schema.json",
  "schema_version": 1,
  "profile_id": "manhattan_showcase_v1",
  "source_profile_id": "manhattan_showcase_v1",
  "source_profile": "Plugins/World/ProjectWorldData/Data/Profiles/SourceIngestion/manhattan_showcase_v1.source.json",
  "budget_profile": "Plugins/World/ProjectWorldData/Data/Profiles/Budgets/manhattan_showcase_v1.budget.json",
  "control_profile": "Plugins/World/ProjectWorldData/Data/Controls/manhattan_showcase_v1.control.json",
  "world_data_plugin": "ProjectWorldData",
  "engine_georeference_origin": [585628, 4511322],
  "identity_namespace": "osm",
  "grid": {
    "terrain_grid_version": 1,
    "canonical_crs": "EPSG:32618",
    "vertical_datum": "EPSG:3855",
    "vertical_origin_m": 0.0,
    "coordinate_transform": "wgs84_to_canonical_crs",
    "origin": [584233.41, 4510392.45],
    "sample_spacing": [30.0, 30.0],
    "coordinate_quantization": 0.01,
    "height_quantization": 0.1,
    "nodata_policy": "reject",
    "resampling_method": "bilinear",
    "cell_quads": [31, 31],
    "alignment_cell_bounds": [-256, -256, 255, 255],
    "halo_samples": 1,
    "operation_halos": {"terrain_resampling": 1, "road_representation": 0, "building_massing": 0}
  },
  "raster_sampling": {"bilinear_warp_scale": [1.0, 1.0]},
  "water_semantics": {
    "policy_id": "manhattan_showcase_water_v1",
    "policy_version": 1,
    "coordinate_match_tolerance_m": 0.01,
    "class_rules": [
      {"water_class": "lake", "geometry": "polygon", "result": "surface", "behavior": "standing"},
      {"water_class": "pond", "geometry": "polygon", "result": "surface", "behavior": "standing"},
      {"water_class": "basin", "geometry": "polygon", "result": "surface", "behavior": "standing"},
      {"water_class": "fountain", "geometry": "polygon", "result": "surface", "behavior": "standing"},
      {"water_class": "pool", "geometry": "polygon", "result": "surface", "behavior": "standing"},
      {"water_class": "reflecting_pool", "geometry": "polygon", "result": "surface", "behavior": "standing"},
      {"water_class": "reservoir", "geometry": "polygon", "result": "surface", "behavior": "standing"},
      {"water_class": "oxbow", "geometry": "polygon", "result": "surface", "behavior": "standing"},
      {"water_class": "stream_pool", "geometry": "polygon", "result": "surface", "behavior": "standing"},
      {"water_class": "wastewater", "geometry": "polygon", "result": "surface", "behavior": "standing"},
      {"water_class": "river", "geometry": "polygon", "result": "surface", "behavior": "standing"},
      {"water_class": "canal", "geometry": "polygon", "result": "surface", "behavior": "flowing"},
      {"water_class": "stream", "geometry": "polygon", "result": "surface", "behavior": "standing"},
      {"water_class": "drain", "geometry": "polygon", "result": "surface", "behavior": "standing"},
      {"water_class": "lock", "geometry": "polygon", "result": "surface", "behavior": "standing"},
      {"water_class": "water", "geometry": "polygon", "result": "surface", "behavior": "standing"},
      {"water_class": "river", "geometry": "line", "result": "surface", "behavior": "flowing"},
      {"water_class": "canal", "geometry": "line", "result": "surface", "behavior": "flowing"},
      {"water_class": "stream", "geometry": "line", "result": "surface", "behavior": "flowing"},
      {"water_class": "tidal_channel", "geometry": "line", "result": "surface", "behavior": "flowing"},
      {"water_class": "ditch", "geometry": "line", "result": "surface", "behavior": "flowing"},
      {"water_class": "drain", "geometry": "line", "result": "surface", "behavior": "flowing"},
      {"water_class": "access_point", "geometry": "point", "result": "non_surface"},
      {"water_class": "waterfall", "geometry": "point", "result": "non_surface"},
      {"water_class": "dam", "geometry": "line", "result": "non_surface"},
      {"water_class": "dock", "geometry": "line", "result": "non_surface"},
      {"water_class": "dock", "geometry": "point", "result": "non_surface"},
      {"water_class": "flowline", "geometry": "line", "result": "non_surface"},
      {"water_class": "link", "geometry": "line", "result": "non_surface"},
      {"water_class": "fairway", "geometry": "line", "result": "non_surface"},
      {"water_class": "boatyard", "geometry": "line", "result": "non_surface"},
      {"water_class": "boatyard", "geometry": "polygon", "result": "non_surface"},
      {"water_class": "weir", "geometry": "point", "result": "non_surface"},
      {"water_class": "weir", "geometry": "line", "result": "non_surface"}
    ],
    "modifier_rules": [
      {"tag": "tunnel", "value": "culvert", "result": "hidden"},
      {"tag": "tunnel", "value": "flooded", "result": "hidden"},
      {"tag": "covered", "value": "yes", "result": "hidden"},
      {"tag": "covered", "value": "no", "result": "visible"},
      {"tag": "location", "value": "underground", "result": "hidden"},
      {"tag": "location", "value": "outdoor", "result": "visible"},
      {"tag": "intermittent", "value": "yes", "result": "temporal"},
      {"tag": "intermittent", "value": "no", "result": "visible"},
      {"tag": "seasonal", "value": "*", "result": "temporal"}
    ],
    "feature_rules": [],
    "surface_groups": [],
    "width": {
      "fallback_accuracy": "heuristic_visual_not_surveyed",
      "fallback_m": {"river": 12.0, "canal": 6.0, "stream": 1.5, "tidal_channel": 6.0, "ditch": 1.0, "drain": 1.0},
      "ribbon_buffer": {"cap_style": "round", "join_style": "round", "quadrant_segments": 8, "suppression_clearance_m": 0.02}
    },
    "elevation": {
      "quantile_interpolation": "linear_r7",
      "rolling_endpoint_policy": "shrink_to_available_samples",
      "standing": {"function_id": "standing_polygon_quantile", "function_version": 1, "quantile": 0.5, "empty_sample_fallback": "ogr_point_on_surface_bilinear"},
      "flowing": {"function_id": "rolling_quantile_l1_isotonic", "function_version": 1, "sample_spacing_m": 30.0, "quantile": 0.5, "rolling_radius": 2, "direction": "non_increasing_by_source_direction", "loss": "l1", "tie_break": "lower_elevation"}
    }
  },
  "terrain_surface": {
    "contract_id": "terrain_surface_semantics",
    "contract_version": 1,
    "roles": ["ground", "hydro_transition"],
    "hydro_transition_radius_m": 60.0,
    "water_clearance_m": 0.0
  },
  "target_cell_range": {"min_x": -6, "max_x": 8, "min_y": -6, "max_y": 7},
  "quality_cells": [
    {"role": "dense_urban", "cells": [{"x": 2, "y": 1}]},
    {"role": "riverbank", "cells": [{"x": -1, "y": 0}]},
    {"role": "suburban", "cells": [{"x": 8, "y": 7}]},
    {"role": "sparse_edge", "cells": [{"x": -4, "y": -6}]},
    {"role": "cross_cell_boundary", "cells": [{"x": 1, "y": 0}, {"x": 2, "y": 0}]}
  ],
  "authored_overlay": "Plugins/World/ProjectWorldData/Data/Controls/manhattan_showcase_empty_overlay_v1.json",
  "fixture_features": null,
  "building_semantics": {
    "policy_id": "provider_neutral_building_volumes",
    "policy_version": 2,
    "maximum_height_m": 600.0,
    "coverage_tolerance_square_m": 0.01,
    "association_policy": "building_relation_then_unique_containing_outline",
    "incomplete_parts_policy": "outline_fallback_or_reject"
  },
  "algorithm_version": "alis-world-compiler-2"
}
